{
  "apiVersion": "iip.dev/v1alpha1",
  "kind": "ReleaseSignatureVerificationReport",
  "metadata": {
    "id": "rsv_df7a6001da05a0f69b7c3c478c697290",
    "generatedAt": "2026-09-07T01:00:00Z",
    "sourceRevision": "0123456789abcdef0123456789abcdef01234567",
    "sourceDirty": false
  },
  "spec": {
    "status": "verified",
    "qualificationLevel": "sigstore-keyless-v1",
    "release": {
      "version": "0.76.0",
      "revision": "0123456789abcdef0123456789abcdef01234567",
      "manifestDigest": "sha256:1111111111111111111111111111111111111111111111111111111111111111"
    },
    "policy": {
      "id": "rsp_organizational-release",
      "generation": 1,
      "digest": "sha256:2222222222222222222222222222222222222222222222222222222222222222",
      "cosignVersion": "3.1.2"
    },
    "environment": {
      "platform": "linux/amd64",
      "pythonVersion": "3.12.10",
      "cosignVersion": "3.1.2"
    },
    "artifacts": [
      {
        "role": "control-plane-image",
        "indexDigest": "sha256:aaaaaaaaaaaaaaaaaaaaaaaaaaaaaaaaaaaaaaaaaaaaaaaaaaaaaaaaaaaaaaaa",
        "trustId": "release-workflow",
        "signatureCount": 1,
        "status": "verified"
      },
      {
        "role": "plugin-mediation-bridge-image",
        "indexDigest": "sha256:dddddddddddddddddddddddddddddddddddddddddddddddddddddddddddddddd",
        "trustId": "release-workflow",
        "signatureCount": 1,
        "status": "verified"
      }
    ],
    "checks": [
      {"id": "release-bundle-integrity", "status": "passed"},
      {"id": "policy-binding", "status": "passed"},
      {"id": "immutable-references", "status": "passed"},
      {"id": "tool-version", "status": "passed"},
      {"id": "control-plane-signature", "status": "passed"},
      {"id": "bridge-signature", "status": "passed"},
      {"id": "exact-trust", "status": "passed"},
      {"id": "transparency-verification", "status": "passed"},
      {"id": "secret-minimization", "status": "passed"}
    ],
    "summary": {
      "totalChecks": 9,
      "passedChecks": 9,
      "failedChecks": 0,
      "notRunChecks": 0,
      "overallStatus": "verified"
    }
  }
}
